{
  "kind": "price-table",
  "version": "1.2.0",
  "currency": "USD",
  "provenance": {
    "source": "Anthropic model pricing: https://platform.claude.com/docs/en/about-claude/pricing; OpenAI model pricing: https://developers.openai.com/api/docs/pricing",
    "retrievedAt": "2026-08-25T00:00:00Z"
  },
  "models": {
    "claude-haiku-4-5": {
      "inputPerMTok": 1,
      "cacheWritePerMTok": 1.25,
      "cacheReadPerMTok": 0.1,
      "outputPerMTok": 5
    },
    "claude-sonnet-5": {
      "inputPerMTok": 2,
      "cacheWritePerMTok": 2.5,
      "cacheReadPerMTok": 0.2,
      "outputPerMTok": 10
    },
    "claude-opus-5": {
      "inputPerMTok": 5,
      "cacheWritePerMTok": 6.25,
      "cacheReadPerMTok": 0.5,
      "outputPerMTok": 25
    },
    "gpt-5.6-luna": {
      "inputPerMTok": 0.2,
      "cacheWritePerMTok": 0.2,
      "cacheReadPerMTok": 0.02,
      "outputPerMTok": 1.2
    },
    "gpt-5.6-terra": {
      "inputPerMTok": 2,
      "cacheWritePerMTok": 2,
      "cacheReadPerMTok": 0.2,
      "outputPerMTok": 12
    },
    "gpt-5.6-sol": {
      "inputPerMTok": 4,
      "cacheWritePerMTok": 4,
      "cacheReadPerMTok": 0.4,
      "outputPerMTok": 20
    },
    "gpt-5.6-cyber": {
      "inputPerMTok": 12.5,
      "cacheWritePerMTok": 12.5,
      "cacheReadPerMTok": 1.25,
      "outputPerMTok": 75
    }
  }
}
